{
  "schema_version": 1,
  "observed_at": "2026-09-16T14:50:00Z",
  "scope": "ACADEMIC_DOOR_WIDE_TOPOLOGY_DYNAMIC",
  "costs": [
    {
      "id": "github-actions",
      "service": "GitHub Actions",
      "owner": "parent-shared-cost-guardrail",
      "consumer": "Academic Door-wide",
      "evidence_class": "UNKNOWN",
      "coverage_status": "ACCOUNT_BILLING_UNKNOWN",
      "amount": null,
      "currency": null,
      "gross_amount": null,
      "discount_amount": null,
      "usage_quantity": null,
      "usage_unit": null,
      "usage_summary": null,
      "status": "seed baseline; live workflow replaces this with accepted organization billing evidence when available",
      "source": "academic-door/academic-door-main-control#54",
      "evidence_observed_at": "2026-09-16T14:50:00Z",
      "plan_state": "included usage/discount contract; numeric remaining allowance not exposed by current evidence",
      "included_quota": null,
      "authorized_paid_budget": null,
      "authorized_paid_budget_currency": null,
      "next_evidence_route": "Continue the accepted GitHub organization billing usage API. Keep remaining included allowance UNKNOWN unless GitHub exposes it directly.",
      "human_action_required": false,
      "human_action_reason": null,
      "note": "Repository/workflow evidence can support estimates; organization billing API is the accepted ACTUAL route."
    },
    {
      "id": "cloudflare",
      "service": "Cloudflare Workers / D1 / runtime",
      "owner": "mixed-product-runtime",
      "consumer": "current known consumers include Working Papers, Composer, and Daily surfaces",
      "evidence_class": "PROVIDER_REPORTED",
      "coverage_status": "PROVIDER_REPORTED_FREE",
      "amount": 0,
      "currency": null,
      "gross_amount": null,
      "discount_amount": null,
      "usage_quantity": null,
      "usage_unit": null,
      "usage_summary": null,
      "status": "Cloudflare account dashboard shows Workers Free active; no payment method on file; no invoices currently present",
      "source": "academic-door/academic-door-main-control#65 comment 5793722228; academic-door/academic-door-operations#13",
      "evidence_observed_at": "2026-09-23T11:05:55Z",
      "plan_state": "Workers Free — Active; no payment method on file; account currently has no invoices",
      "included_quota": null,
      "authorized_paid_budget": null,
      "authorized_paid_budget_currency": null,
      "next_evidence_route": "Refresh from the authoritative Cloudflare Billing dashboard if subscription state changes or if future billable usage/invoices appear; do not infer unexposed usage quantities.",
      "human_action_required": false,
      "human_action_reason": null,
      "note": "PROVIDER_REPORTED $0 applies to the observed recurring Workers Free subscription/account invoice state only; it is not generalized to future upgrades, other Cloudflare accounts, or unexposed usage."
    },
    {
      "id": "deepseek-daily-door",
      "service": "DeepSeek AI / translation / enrichment — Daily Door",
      "owner": "daily-door",
      "consumer": "academic-door/econ-paper-monitor",
      "evidence_class": "ESTIMATED",
      "coverage_status": "ESTIMATED_USAGE",
      "amount": 0.154469488,
      "currency": "USD",
      "gross_amount": null,
      "discount_amount": null,
      "usage_quantity": 2270,
      "usage_unit": "requests/rolling-30d",
      "usage_summary": "rolling30d_estimated_cost=0.154469488 USD; rolling30d_requests=2270",
      "status": "owner-metered usage × pinned pricing; not provider-billed cash spend",
      "source": "academic-door/econ-paper-monitor:data/ai_cost_usage.json",
      "evidence_observed_at": "2026-09-20T09:51:21+00:00",
      "plan_state": null,
      "included_quota": null,
      "authorized_paid_budget": null,
      "authorized_paid_budget_currency": null,
      "next_evidence_route": "Continue owner request/token metering for ESTIMATED cost; use an authoritative DeepSeek billing/usage console, export, or read-only account API to promote billed spend to ACTUAL.",
      "human_action_required": false,
      "human_action_reason": null,
      "note": "Seed carries the latest accepted estimate; scheduled owner telemetry refreshes it."
    },
    {
      "id": "qwen-dashscope",
      "service": "Qwen / DashScope / Alibaba Cloud AI",
      "owner": "daily-door-benchmark-capability",
      "consumer": "current credential metadata includes Academic Door organization scope",
      "evidence_class": "UNKNOWN",
      "coverage_status": "CAPABILITY_ONLY_NO_SPEND_EVIDENCE",
      "amount": null,
      "currency": null,
      "gross_amount": null,
      "discount_amount": null,
      "usage_quantity": null,
      "usage_unit": null,
      "usage_summary": null,
      "status": "benchmark/capability candidate only; no current production Qwen/DashScope usage or spend evidence",
      "source": "academic-door/academic-door-operations#11",
      "evidence_observed_at": "2026-09-23T12:10:00Z",
      "plan_state": null,
      "included_quota": null,
      "authorized_paid_budget": null,
      "authorized_paid_budget_currency": null,
      "next_evidence_route": "Do not seek account billing merely to clear observability. If an owner later activates a real Qwen/DashScope benchmark or production route, ingest owner request/token telemetry and then provider billing evidence as applicable.",
      "human_action_required": false,
      "human_action_reason": null,
      "note": "Credential/capability planning does not establish active spend. econ-paper-monitor#163 remains capability-blocked; production routing is unchanged."
    },
    {
      "id": "jina",
      "service": "Jina AI provider",
      "owner": "product-local-shared-capability-candidate",
      "consumer": "current known consumers include Daily Door and Journals",
      "evidence_class": "UNKNOWN",
      "coverage_status": "HUMAN_REPORTED_NO_PAID_SPEND",
      "amount": null,
      "currency": null,
      "gross_amount": null,
      "discount_amount": null,
      "usage_quantity": null,
      "usage_unit": null,
      "usage_summary": null,
      "status": "Human Principal reports no payment has ever been made for Jina; current provider plan/credit balance remains unverified",
      "source": "academic-door/academic-door-main-control#65 comment 5794858195; academic-door/academic-door-operations#15 comment 5794858977",
      "evidence_observed_at": "2026-09-23T12:30:00Z",
      "plan_state": null,
      "included_quota": null,
      "authorized_paid_budget": null,
      "authorized_paid_budget_currency": null,
      "next_evidence_route": "No billing login is required merely to establish whether Academic Door has paid Jina. Re-open provider account evidence only if future plan/credit decisions become material or an owner path needs entitlement/quota evidence.",
      "human_action_required": false,
      "human_action_reason": null,
      "note": "Human-Principal-reported no paid spend is not provider-reported plan or invoice evidence; do not infer free tier, remaining credits, or future billing."
    },
    {
      "id": "supabase-academic-door",
      "service": "Supabase — Academic Door project",
      "owner": "parent-shared-or-project-runtime",
      "consumer": "Academic Door project under organization simon-world",
      "evidence_class": "PROVIDER_REPORTED",
      "coverage_status": "PROVIDER_REPORTED_FREE",
      "amount": 0,
      "currency": null,
      "gross_amount": null,
      "discount_amount": null,
      "usage_quantity": null,
      "usage_unit": null,
      "usage_summary": null,
      "status": "provider message identifies the Academic Door project as free tier; project was auto-paused after inactivity",
      "source": "provider account message summarized at academic-door/academic-door-main-control#65 comment 5758457626",
      "evidence_observed_at": "2026-09-12T17:12:49Z",
      "plan_state": "free tier",
      "included_quota": null,
      "authorized_paid_budget": null,
      "authorized_paid_budget_currency": null,
      "next_evidence_route": "Refresh from authoritative Supabase account plan/billing evidence before claiming a later plan state; any upgrade remains outside this tranche.",
      "human_action_required": false,
      "human_action_reason": null,
      "note": "PROVIDER_REPORTED $0 applies only to the observed free-tier project state and is not generalized beyond it."
    },
    {
      "id": "firecrawl",
      "service": "Firecrawl browser/crawl credits",
      "owner": "parent-governed-exception-capability",
      "consumer": "Academic Door browser/crawl exception routes",
      "evidence_class": "PROVIDER_REPORTED",
      "coverage_status": "PROVIDER_REPORTED_QUOTA",
      "amount": null,
      "currency": null,
      "gross_amount": null,
      "discount_amount": null,
      "usage_quantity": 1000,
      "usage_unit": "included credits/cycle",
      "usage_summary": "1000 included credits consumed; provider states renewal on 2026-10-08",
      "status": "included quota exhausted; paid fallback is not authorized",
      "source": "provider account messages summarized at academic-door/academic-door-main-control#65 comment 5758457626; Decision 0018",
      "evidence_observed_at": "2026-09-19T18:16:32Z",
      "plan_state": "included/free credits; paid fallback prohibited by current Parent policy",
      "included_quota": "1000 credits/cycle; exhausted; renews 2026-10-08",
      "authorized_paid_budget": 0,
      "authorized_paid_budget_currency": "USD",
      "next_evidence_route": "Use provider account billing/plan evidence if historical/current billed spend must be established. Do not add a payment method, auto-upgrade, or paid fallback from Operations.",
      "human_action_required": false,
      "human_action_reason": null,
      "note": "Authorized paid budget $0 is governance metadata and must not be interpreted as proof of actual billed spend $0."
    },
    {